{
  "amount": "726.63",
  "datetime": "2025-05-22T14:15:20",
  "end_to_end_id": "E08562314202505221415nbbZ3Cdgxnv",
  "description": null,
  "payer": {
    "name": "Sr. Fernando Sousa",
    "document": "***.179.367-**",
    "institution": "Banco Tucano S.A.",
    "agency": null,
    "account": null
  },
  "payee": {
    "name": "da Mata Camargo S/A",
    "document": "97.360.093/0001-05",
    "institution": "Jatobá Banco Digital S.A.",
    "agency": null,
    "account": null
  },
  "payee_key": "+55 53 94031-6666"
}
