{
  "amount": "1.09",
  "datetime": "2025-01-01T11:36:02",
  "end_to_end_id": "E17345602202501011136Nw15cQsvQe1",
  "description": null,
  "payer": {
    "name": "Kauã Albuquerque",
    "document": "***.057.873-**",
    "institution": "Banco Pampa S.A.",
    "agency": null,
    "account": null
  },
  "payee": {
    "name": "Rayssa Siqueira",
    "document": "***.409.780-**",
    "institution": "Ipê Instituição de Pagamento",
    "agency": "9579",
    "account": "70641798-0"
  },
  "payee_key": "7aadb823-41e3-41e2-9f14-546cf113fb46"
}
